{
  "cert_type": "IO-CERT",
  "cert_version": "v1",
  "map_O_theta": "EWBG/LEP umbrella predicts Y_B plus correlated EDM/GW (EWBG). Locks enforce matching to Y_obs and EDM bound.",
  "theta_effective_list": [
    "mode",
    "Lambda_CPV_GeV",
    "sin_delta",
    "vc_over_Tc",
    "beta_over_H",
    "alpha_PT",
    "epsilon1"
  ],
  "observables_list": [
    "Y_B",
    "d_e",
    "f_peak_mHz",
    "Omega_GW"
  ],
  "identifiability_metric": {
    "name": "toy_correlation_proxy",
    "value": 0.2
  },
  "threshold_tau": 0.1,
  "degeneracies_list": [
    "Toy; real model degeneracies handled via IO + datasets (EDM/GW)."
  ],
  "dataset_equivalence": [
    "mrd_baryo_obs_v1"
  ]
}