{
  "cert_type": "IO-CERT",
  "cert_version": "v1",
  "map_O_theta": "Proposal observables must map to dictionary invariants (trace class functions).",
  "theta_effective_list": [
    "dict_invariant_values"
  ],
  "observables_list": [
    "claimed_observables"
  ],
  "identifiability_metric": {
    "name": "toy_nontrivial_mapping",
    "value": 0.2
  },
  "threshold_tau": 0.1,
  "degeneracies_list": [
    "if mapping incomplete -> NO-EVAL(4U2)"
  ],
  "dataset_equivalence": [
    "dict_artifact_toy_v1"
  ]
}