{
  "cert_type": "IO-CERT",
  "cert_version": "v1",
  "map_O_theta": "Params=(gamma_ppn,beta_ppn,cT/c). Locks enforce PPN bounds and GW speed bound within IR domain.",
  "theta_effective_list": [
    "gamma_ppn",
    "beta_ppn",
    "cT_over_c"
  ],
  "observables_list": [
    "GR2_PPN",
    "GR3_GW_SPEED"
  ],
  "identifiability_metric": {
    "name": "toy_constraint_proxy",
    "value": 0.2
  },
  "threshold_tau": 0.1,
  "degeneracies_list": [
    "Toy; real PPN has correlations and systematics."
  ],
  "dataset_equivalence": [
    "mrd_grav_ir_bounds_v1"
  ]
}