{
  "cert_type": "IO-CERT",
  "cert_version": "v1",
  "map_O_theta": "O = Tr(U(loop))/2; parameters are axis/angle of paths (toy)",
  "theta_effective_list": [
    "angle_p1",
    "angle_p2",
    "angle_p3"
  ],
  "observables_list": [
    "O1",
    "O2"
  ],
  "identifiability_metric": {
    "name": "toy_rank_proxy",
    "value": 0.2
  },
  "threshold_tau": 0.1,
  "degeneracies_list": [
    "toy dataset may be underdetermined; here we only require minimal tau"
  ],
  "dataset_equivalence": [
    "mrd_4f_dict_spec_v1"
  ]
}