{
  "cert_type": "IO-CERT",
  "cert_version": "v1",
  "map_O_theta": "O(E)=1+C6(E)(E/Λ)^2; RG provides C6(E). Locks enforce RG consistency and informative truncation.",
  "theta_effective_list": [
    "C6(mu0)",
    "gamma",
    "Lambda",
    "c8_max_abs"
  ],
  "observables_list": [
    "O(E)",
    "ΔO_bound",
    "RG consistency"
  ],
  "identifiability_metric": {
    "name": "toy_sensitivity_proxy",
    "value": 0.2
  },
  "threshold_tau": 0.1,
  "degeneracies_list": [
    "Toy; real EFT has operator basis degeneracies handled by IO judge."
  ],
  "dataset_equivalence": [
    "mrd_eft_ren_data_v1"
  ]
}